YES Premia Credit Card,Travel,Rs. 999 (plus applicable taxes),Rs. 999 (plus applicable taxes),NA,"12 Reward Points on every Rs. 200 on Travel and Dining spends. 6 Reward Points per Rs. 200 you spend. 3 Reward Points per Rs. 200 you spend on tax payments, postal services, bus lines, government services, etc.",Get complimentary Priority Pass Membership with complimentary lounge access.,1 complimentary lounge access per quarter.,"A credit shield cover worth Rs. 2.5 lakhs, Life Insurance Cover of Rs. 1 Crore in case of Flight Accidental Death, and Medical Insurance cover of Rs. 30 Lakhs for overseas emergency hospitalization.",25% discount on movies through Bookmyshow.,"The Reward points earned are redeemable through the dedicated website Yes Rewardz at a rate of 1 RP = Re. 0.25 when redeemed against hotel/flight bookings, and 1 RP= Re. 0.10 when redeeming against gift vouchers, product catalogue, etc.",4 Green Fee waiver and 1 complimentary golf lesson every month at selected golf courses in India,3 complimentary access to international lounges through the Priority Pass.,The cardholder will not be held liable for any unauthorized transactions if the loss has been reported to the bank within 3 days of the same.,"The joining fee can be waived if you spend Rs. 25,000 within ninety days after activating the card and the annual fee can be waived if you spend Rs. 1.5 lakhs or more in the preceeding year.",Rs. 100,2.75% on all foreign currency transactions.,3.6% per month,"1% fuel surcharge waiver on fuel transactions between Rs. 400 and Rs. 5,000.",2.5% or the transacted amount or Rs. 300 (whichever is higher).,NA,"Identity Proof: Aadhar Card, PAN Card, Passport, Driving License, Voter’s ID, etc.
Address Proof: Utility bills, Driving License, Aadhar Card, etc.
Proof of Income: Latest bank statements/salary slips (in case of salaried individuals) or Latest audited ITR (in case of self-employed people).",NA
YES Bank Wellness Plus Credit Card,Travel,"Rs. 1,499 (plus applicable taxes)","Rs. 1,499 (plus applicable taxes)",NA,"6 Reward Points per Rs. 200 spent, 30 Reward Points per Rs. 200 spent on chemist/pharmaceutical stores.",Get complimentary access to domestic lounges,8 complimentary access to domestic lounges annually (2 per quarter).,"Get a life insurance cover of Rs. 1 Crore, a medical insurance cover worth Rs. 25 lakhs, and a credit shield in case of primary cardholder’s accidental death.",NA,The reward points are redeemable on Yes Rewardz,NA,NA,"If the lost or stolen card is reported to the bank within 3 days, then no liability falls on the cardholder towards any unauthorized transaction.",NA,Rs. 100,3.5% on all international spends.,3.5% per month.,"1% fuel surcharge waiver on all fuel transactions above Rs. 400 and below Rs. 5,000.",2.5% of the amount withdrawn or Rs. 300 (whichever is higher).,NA,NA,NA
Yes Bank Wellness Credit Card,Shopping,Rs. 749 plus applicable taxes,Rs. 749 plus applicable taxes,NA,1 Reward Point = Rs 0.25,NA,NA,You get a Credit Shield coverage in case of accidental death of Primary cardholder,"Great offers and discounts on movies, shopping, travel, and wellness at participating locations on YES Privileges.","Reward Points can be redeemed by visiting credit.yesrewardz.com/ or by calling Yes Rewardz Customer Care at 1800 4190 600 between 9 a.m. and 9 p.m., Monday through Sunday.",NA,NA,NA,NA,Redemption Fee of Rs 100/- plus GST is applicable,A conversion rate of 3.5% is charged,42% per annum (3.5% per month),"1% fuel surcharge waiver at all fuel stations in India on transactions between INR 400 to INR 5,000","2.5% of the transaction amount or Rs. 300, higher of the two.",NA,NA,NA
YES Prosperity Cashback Plus Credit Card,Shopping,Rs 1499 plus applicable taxes,Rs 1499 plus applicable taxes,A cashback of Rs. 250 on spending Rs. 2500 within the first 30 days.,"0.75% cashback on all retail spends, 5% cashback on movies & groceries.",NA,NA,Credit shield cover in case of death of the primary cardholder,NA,NA,NA,NA,The cardholder will not be liable for transactions done on a lost/stolen card if the loss is reported to the bank within 3 working days.,NA,Rs. 100 on every redemption request,3.4% on all foreign currency spends,3.5% per month,"1% fuel surcharge is waived off for all transactions between Rs. 400 & Rs. 5,000.",2.5% of the withdrawn amount or Rs. 300 (whichever is higher).,NA,NA,NA
YES Bank BYOC Credit Card,Shopping,"Rs. 49 plus applicable taxes
Rs. 3,499 (for metal variant)
Rs. 249 (for eco-friendly variant)","Rs. 49 plus applicable taxes
Rs. 3,499 (for metal variant)
Rs. 249 (for eco-friendly variant)",NA,1% cash back or 8 Reward Points on every retail spend of Rs. 200 (choose between rewards/cashback).,Complimentary airport lounge access every quarter.,1 complimentary domestic lounge access every quarter.,NA,NA,The Reward Points can be redeemed against various options via the YesRewardz portal where 1 Reward Point = up to Re. 0.25.,4 complimentary rounds of golf every year.,NA,The cardholders will not be liable for any fraudulent transactions if the loss has been reported to the bank in a timely manner.,NA,NA,3.4% of the total transaction amount,3.5% per month.,1% fuel surcharge waiver on all fuel transactions,2.5% of the withdrawn amount subject to a minimum of Rs. 300.,NA,NA,NA
YES Prosperity Rewards Plus Credit Card,Shopping,Rs. 399 (plus applicable taxes),Rs. 399 (plus applicable taxes),NA,"On every retail spend of Rs. 200, cardholders will get Reward Points, and 2 Reward Points on every Rs. 100 spent on tax payments, utilities, postal services, etc.",NA,NA,"In case of the accidental death of the primary cardholder, a credit shield cover is provided.",NA,The reward points can be redeemed against a variety of products and vouchers available on the website.,NA,NA,Zero liability of the cardholder against any inappropriate transaction that takes place if the card is lost or stolen and the same is reported to the bank within the prescribed time frame.,Waiver of joining and renewal fee on the basis of the amount spent using the credit card.,Rs. 100 on every redemption request.,2.75% only,3.6% per month,1% fuel surcharge is waived off across all fuel stations in India.,2.5% or Rs. 300 (whichever is higher),NA,NA,NA
YES Prosperity Edge Credit Card,Shopping,Rs. 399 (plus applicable taxes),Rs. 399 (plus applicable taxes),NA,"4 Reward Points on every Rs. 200 spent on all categories except select categories, 2 Reward Points on every Rs. 200 spent on select categories and 500 Reward Points on each Yes PayNow registration.","1 complimentary domestic lounge access per quarter.
Complimentary Priority Pass Membership.",You get 1 complimentary domestic lounge access per calendar quarter subject to 2 visits per quarter.,A cover worth Rs. 50 lakhs for death due to air accident and medical insurance worth Rs 15 lakhs.,8 Reward Points on every Rs. 200 on Dining Spends,"Reward Points redeemable for movie ticket bookings on YES Rewardz portal at a rate of 1 Reward Point = Re. 0.25 for redemption against hotel/flight bookings, and 1 Reward Point = Re. 0.10 for redemption against gift vouchers, product catalogue, etc.",4 complimentary rounds of green fees every year and 1 complimentary golf lesson each month.,You get complimentary international lounge access Priority Pass membership at a charge of USD 27 per person,"You get a protection liability cover in case of the fraudulent charges, if reported within a stipulated time","Joining fee waiver on spending Rs. 15,000 or more within 90 days after receiving the card and the renewal fee is waived off on a spend of Rs. 75,000 or more in the previous year.",Rs. 100 on every redemption request.,2.75% on all foreign currency spends,3.6% per month,"1% fuel surcharge waiver at all the fuel stations in India for all the transactions between Rs. 400 and Rs. 5,000.",3.5% of the amount withdrawn,NA,NA,NA
YES Prosperity Rewards Credit Card,Shopping,Rs. 399 plus applicable taxes,Rs. 399 plus applicable taxes,NA,"2 Reward Points on every Rs 200 spent on all categories other than select categories
1 Reward Point for every INR 200 on Select categories",NA,NA,NA,NA,"You can redeem your reward points from the product catalog at the YESREWARDZ portal. These reward points can also be redeemed for Air miles. You can use 10 Reward Points to redeem 1 InterMile or 1 Club Vistara. 1 RP = Rs. 0.10 (e-vouchers, recharges, movies and more). RP 1 = Rs. 0.25 for hotel and flight booking.",NA,NA,The protection is provided to the cardholder in case of any fraudulent charges if reported within the stipulated time period,"Annual fee waiver on spend of Rs 5000/- within first 90 days of the card issuance.  On annual spend of Rs 25,000/- get the annual fee waived off",Rs 100 per redemption request,3.40 % of the conversion rate,3.6% per month (43.2% per annum),1% surcharge waiver on fuel transactions across all fuel stations for transactions between Rs 400 to Rs 5000/,2.5% of the transaction amount subject to a minimum charge of Rs 300.,NA,NA,NA
YES Bank EMI Credit Card,Shopping,Rs. 499,Rs. 499,NA,Get 1% cashback on all retail purchases and 3% cashback on selected transactions through YES Cart.,NA,NA,NA,NA,The earned cashback is directly credited to the cardholders’ accounts.,NA,NA,You get zero liability protection against a lost/stolen card if reported to the bank in a timely manner.,The renewal fee of Rs. 499 is waived on spending Rs. 1.2 lakhs or more in the previous anniversary year.,NA,3.5% of the total amount,3.5% per month,1% fuel surcharge waiver capped at Rs. 250 per month.,2.5% of the withdrawn amount or a minimum of Rs. 500,NA,NA,NA
IDFC FIRST Millennia Credit Card,Shopping,NA,NA,5% cashback on first EMI spend and additional gift vouchers worth Rs. 500.,"3 Reward Points on each offline spend of Rs. 100, 6 RPs per online spend of Rs. 100, and 10 Rewards on every Rs. 100 on spends above Rs. 20,000.",Complimentary Railway lounge access 4 times in a quarter.,NA,"Personal Accidental Cover worth Rs. 2 Lakhs on all active cards. Lost Card Liability Cover of Rs 25,000.","Up to 20% discount on more than 1,500 Restaurants across India. Avail 25% discount on movie tickets once a month (up to Rs. 100).",NA,NA,NA,"Zero Liability protection upto Rs 25,000. Not valid on PIN Based transactions.",NA,NA,3.5% of the total transaction value.,Starting from 0.75% and goes up to 2.99% per month.,1% fuel surcharge waiver at all fuel stations and on all fuel purchases across India (Upto Rs 200 every month).,Transaction fees of Rs 250,NA,NA,NA
IDFC FIRST Classic Credit Card,Travel,NA,NA,"Get a welcome gift voucher worth Rs. 500 on spending Rs. 15,000 or more within the first 90 days.",3 Reward Points on every offline spend of Rs. 150 & 6 Reward Points on every online spend of Rs. 150.,Get complimentary Railway lounge access,4 complimentary Railway lounge access every quarter.,Accidental death cover worth Rs. 2 lakhs and a cover for a lost card is provided.,Get a 25% discount on movies (up to Rs. 100) and up to a 20% discount on dining through your IDFC FIRST Classic Credit Card.,"The Reward Points can be redeemed instantly for online transactions & partner stores. Here, 1 Reward Point = Rs. 0.25.",NA,NA,You will not be liable for any fraudulent transactions made on your card if the loss is reported to the bank in a timely manner.,NA,NA,3.5% on all foreign currency spends.,0.75% to 3.5% per month,1% fuel surcharge waiver (up to Rs. 200 per statement cycle),Rs. 250,NA,"Aadhar Card, Voter’s Id, Driving License, PAN Card, or Passport as an identity proof.
Latest months’ utility bills, Aadhar Card, or Passport as an address proof.
You will also need to submit your latest salary slips/latest bank statements, or latest audited ITR.",NA
IDFC FIRST Select Credit Card,"Travel , Shopping",NA,NA,Welcome gifts worth Rs. 500 in the form of vouchers based on spends within 90 days of card issuance and a 5% cashback on EMI transactions within 90 days of card issuance.,"3 Reward Points on each Rs. 125 spent offline, 6 Reward Points on each Rs. 125 spent online, and 10 Reward Points on every Rs. 125 on spends above Rs. 25,000.",Complimentary lounge access at select airports and railway stations across India,4 complimentary domestic airport lounge visits and 4 complimentary railway lounge visits per quarter.,"You get personal accident cover worth upto Rs 5,00,000 and a travel insurance cover worth up to Rs 22,500.",Buy One Get One free offer on movies & up to 20% discount on dining.,1 Reward point = Re. 0.25 for redemption. These reward points can be redeemed at the Poshvine reward portal or at exclusive merchant stores.,NA,NA,"You get a zero liability protection cover worth Rs 50,000 against any fraudulent transactions reported within the stipulated time.",NA,NA,1.99% of the total conversion amount,Ranges between 0.75% to 3.5% based upon the credit history of the individual,1% surcharge waived on all fuel purchases at all petrol pumps across India subject to a maximum amount of Rs. 300.,Rs. 250,NA,"Aadhar Card, Voter’s Id, Driving License, PAN Card, or Passport as an identity proof.
Latest months’ utility bills, Aadhar Card, or Passport as an address proof.
You will also need to submit your latest salary slips/latest bank statements, or latest audited ITR.",NA
IDFC FIRST Wealth Credit Card,Shopping,NA,NA,Gift Vouchers worth Rs. 500 from premium brands and a 5% cashback on the first EMI transaction made within the first 90 days.,"3 Reward Points on every Rs. 100 spent offline, 6 Reward Points on every Rs. 100 spent online, 10 Reward Points per Rs. 100 on spends above Rs. 30,000.",You get complimentary international as well as domestic lounge access and spa visits every year.,Up to 4 free visits to domestic airport lounges per quarter.,"Travel-related insurance benefits including accidental air death insurance worth Rs. 1 crore, personal accident coverage worth Rs. 10 lakh, and lost card liability cover worth Rs. 50,000","Rs. 500 off on the second movie ticket onwards on Paytm mobile app (max two free tickets can be availed in a month), up to 20% discount on over 1,500 restaurants.",Reward Points redeemable on Poshvine redemption portal for shopping vouchers from many popular brands including at a rate of 1 Reward Point = Rs. 0.25.,"Complimentary golf rounds each month for every Rs. 20,000 spent in the previous month (max 2 golf rounds in a month).",Up to 4 complimentary international lounge visits per quarter.,"Bank not liable for any unauthorized transaction prior to the time of reporting the loss of card. However, you do get a lost card liability cover worth Rs. 50,000.",NA,NA,1.5% + GST,0.75% to 3.5% per month depending upon the credit history of the card member.,A 1% fuel surcharge is waived at all authorized fuel stations  (max waived amount capped at Rs. 400/month).,Rs. 250 per transaction,NA,"The First Wealth Credit Card offered by IDFC First Bank comes with zero annual & joining fees, i.e, it is a lifetime free/no annual fee credit card.
This credit card charges an interest of 0.75% to 3.5% per month.
The fee on foreign currency transactions made through the IDFC First Wealth Credit Card is 1.5% of the total transaction amount.
The cash withdrawal fee on this card is 2.5% of the withdrawn amount.",NA
IDFC FIRST WoW Credit Card,"Dining , Shopping",NA,NA,"Enjoy 5% Cashback up to Rs. 1,000 on the first EMI transaction done within 90 days of card activation.",Earn 4X (4RP) Reward Points on every spend,NA,NA,"Personal Accident, Card Liability cover and many more.",20% discount at 1500+ restaurants with IDFC FIRST WoW Credit Card.,,NA,NA,You will not be liable for any fraudulent transactions made on your card if the loss is reported to the bank in a timely manner.,NA,Rs. 99 per redemption transaction,NA,0.75% – 3.5% p.m. (9% – 42% p.a.),1% fuel surcharge waiver (up to Rs. 200 per statement cycle),Rs. 250,NA,NA,Conclusion
IDFC First Private Credit Card,,"Rs. 50,000","Rs. 50,000",NA,3 Reward Points on every Rs. 100 spent offline and 6 RPs on every Rs. 100 spent online,Get free airport lounge access and spa sessions every year.,4 complimentary domestic lounge access every quarter (for primary and add-on cardholders),Get an air accident cover worth Rs. 1 crore,Get up to Rs. 750 discount on movie/non-movie bookings via BookMyShow,1 Reward Point = Re. 0.25 for redemption against various gift vouchers,2 complimentary golf rounds/lessons every month,4 complimentary domestic lounge access every quarter (for primary and add-on cardholders),The cardholders get a zero liability protection against a lost/stolen card if reported the loss to the bank in a timely manner.,NA,NA,NA,0.99% per month,1% fuel surcharge waiver on all fuel purchases,Rs. 250,"NA for 1st card, 2nd card onwards: Rs. 4,000 per add-on card",NA,NA
AU Small Finance Bank Altura Plus Credit Card,Shopping,Rs. 499 + applicable taxes,Rs. 499 + applicable taxes,Gift voucher worth Rs. 500 from some top brands.,"1.5% cashback on all POS retail spends, 1 Reward Point per Rs. 100 spent after reaching the maximum cashback limit.",Get complimentary railway lounge access at selected locations in India,2 complimentary domestic lounge access every calendar quarter.,NA,NA,The earned reward points can be redeemed at the AU Rewardz portal at a rate of 1 Reward Point = Re. 0.25.,NA,NA,You will not be liable for any fraudulent transactions made on your card once the card is reported lost/stolen to the bank.,"Joining fee waived off on spending Rs. 20,000 or more within the first 90 days and the renewal fee waived off on spending Rs. 80,000 in the previous year.",NA,3.49% on all foreign currency spends.,3.49% per month,"1% fuel surcharge waiver for all transactions between Rs. 400 & Rs. 5,000.",2.5% of the transacted amount or Rs. 100,NA,NA,NA
AU Bank Zenith Credit Card,"Travel , Dining , Shopping","Rs. 7,999 (plus applicable taxes)","Rs. 7,999 (plus applicable taxes)","Get Zomato Pro membership after 5 successful transactions, Rs. 1,000 worth of Vouchers after the first POS transaction,
10,000 Bonus
RPs on spending Rs. 1 Lakh. Every welcome benefit would be applicable for retail spends made within sixty of card set-up.","20 Reward Points for every Rs. 100 spent on dining (reward rate = 5%), 10 Reward Points for every Rs. 100 spent on international purchases and grocery & departmental stores (reward rate = 2.5%) and 5 Reward Points for every Rs. 100 spent on all other spends except fuel (reward rate = 1.25%)","Reward Points can be redeemed for flight and hotel bookings on AU Rewardz portal, get complimentary access to domestic as well as international airport lounges, complimentary access to IRCTC lounges.",4 per quarter with Visa domestic lounge access program,"Comprehensive insurance cover including lost card liability cover, Credit Shield, air accident cover, and multiple other travel-related insurance covers",20 Reward Points for every Rs. 100 spent on dining at standalone restaurants,"Reward Points can be redeemed for merchandise, e-vouchers, mobile or DTH recharges, flight or hotel bookings on AU Rewardz portal, 1 RP = Rs. 0.25",NA,2 every quarter with Priority Pass membership,The cardholder will not be held liable for any unauthorized transaction done with the card after reporting the loss of the card to the bank.,"Joining fee can be waived on spending of Rs. 1.25 lakh within 90 days of card activation, annual fee can also be waived on spending Rs. 5 lakh in the previous year",NA,1.99% of the transaction amount,1.99% per month (23.88% annually),1% fuel surcharge waived off at all fuel pumps all over India (no max cap applicable),2.5% of the transaction amount (subject to a minimum charge of Rs. 100),NA,NA,NA
AU Bank Vetta Credit Card,"Travel , Shopping","Rs. 2,999 (plus applicable taxes)","Rs. 2,999 (plus applicable taxes)","Vouchers worth Rs. 2,000 from top brands on a minimum expenditure of Rs. 30,000 within 60 days of card setup.","10 Reward Points per Rs. 100 on utility bill payments (reward rate = 2.5%), 4 Reward Points per Rs. 100 on grocery and departmental store spends (reward rate = 1%), 2 Reward Points per Rs. 100 on all other retail spends except fuel (reward rate = 0.5%)","Reward Points redeemable for flight/hotel bookings on AU Rewardz portal, complimentary domestic and international airport lounge access, complimentary IRCTC loucnge access",1 per quarter under Visa domestic lounge program,"Comprehensive insurance cover including Credit Shield, lost card liability cover, air accident cover and many other travel-related insurance covers",NA,"Reward Points redeemable for e-vouchers, merchandise, mobile/DTH recharges, flight/hotel bookings on AU Rewardz portal, 1 Reward Point = Rs. 0.25",NA,1 per quarter with Priority Pass membership,Cardholder not liable for any fraudulent transaction with the card post reporting the loss of card to the bank,"Joining fee waived off on expenditure of Rs. 40,000 within 90 days of card setup, renewal fee (second year onwards) waived off on expenditure of Rs. 1.5 lakh in the preceding year",NA,2.99% of the transaction amount,2.99% per month (35.88% annually),"Fuel surcharge waived off at all filling stations across India for transactions between Rs. 400 and Rs. 5,000 (max waiver capped at Rs. 250 per month)",2.5% of the transaction amount (subject to a minimum charge of Rs. 100),NA,NA,NA
AU Small Finance Bank Altura Credit Card,Shopping,Rs. 199 + applicable taxes,Rs. 199 + applicable taxes,"Get a 5% cashback on retail spends worth Rs. 2,500 or more within 60 days.","Cashback of 2% on utility bills, groceries, and departmental stores and cashback of 1% on all other spends.",Complimentary access to railway lounges.,2 complimentary visits to railway lounges in India per quarter.,NA,NA,NA,NA,NA,Zero liability of the credit cardholder in case of loss or theft of card post reporting the same to the bank.,The joining and renewal fees will be waived off on the basis of the amount that you spend using your credit card.,NA,3.49% on all international spends.,3.49% per month,"Surcharge waiver of 1% on fuel transactions between Rs. 400 and Rs. 5,000.","Rs. 100 or 2.5% of the cash amount withdrawn, higher of the two.",NA,NA,NA
AU Bank LIT Credit Card,"Movies , Travel , Dining , Fuel , Shopping",NA,NA,NA,"1 Reward Point for every Rs. 100 spent on retail with the card, 10X or 5X accelerated Reward Points (For Specific Feature) and Additional cashbacks (For Specific Feature)",Complimentary access to domestic lounges in India.,4 complimentary lounge access per quarter,NA,"3 Months of complimentary Membership of Zee5, Amazon Prime and Additional 5% cashback for Dining expenses.",Redeem Reward Points for exciting discounts and offers.,NA,NA,Zero liability of the cardholder against fraudulent transactions in the event of loss or theft of the credit card if the same is reported to the customer care of the bank within 7 days from the loss of the card.,NA,NA,3.49% on all foreign currency spends.,3.49% per month,"1% fuel surcharge waiver for fuel transactions between Rs. 400 and Rs. 5,000.",2.5% of the transaction amount (subject to a minimum charge of Rs. 100),NA,NA,NA
Indusind Bank Pioneer Heritage Credit Card,"Movies , Travel","Rs. 90,000 + GST","Rs. 90,000 + GST",Oberoi e-gift voucher and a Luxe Gift card.,2.5 Reward Points for Rs 100 spent on international transactions and 1 Reward Points for Rs 100 spent on domestic transactions.,"Complimentary Domestic and International lounge access, complimentary LoungeKey membership and get a complimentary third-night stay at Oberoi Hotels and Resorts.",Unlimited (with Pioneer Heritage Metal credit card) and 2 per quarter (with Pioneer Heritage credit card),Complimentary air accident protection cover worth upto Rs 2.5 crore on this credit card,"Up to 3 complimentary tickets every month on Pioneer Heritage credit card and 4 Complimentary tickets every calendar quarter on Pioneer Heritage Metal credit card. Also, you get 20% off on your non-movie bookings.","1 RP = Rs 1 redeemed against a host of redemption options such as the Indus Moments reward portal, AirMiles, and against statement cash","12 complimentary rounds of green fees & 12 complimentary golf lessons every year. Also, you get 4 complimentary green fees rounds for guests.",Unlimited (with Pioneer Heritage Metal credit card) and 2 per quarter using LoungeKey membership (with Pioneer heritage Credit Card).,A protection liability cover in case of any fraudulent transactions reported within 48 hours,Waiver of the annual fee on the amount spent using this credit card in the previous year.,Rs. 100 per redemption request,1.8% of the amount transacted.,2.99% per month (35.88% per annum),"Surcharge waiver of 1% on fuel transactions between Rs. 400 and Rs. 4,000.",NA,NA,NA,NA
