Axis Bank Platinum Credit Card,Shopping,Rs. 500,Rs. 500,100 Edge Rewards on first online transaction.,6 Edge Rewards on every domestic spend of Rs. 200 and 12 Edge Rewards on every international spend of Rs. 200.,NA,NA,NA,"You get 25% off on movie tickets, and a minimum discount of 15 % on dining at partner restaurants in India.","The accumulated EDGE REWARD points can be redeemed for purchasing vouchers, mobiles & accessories, and much more exciting products. 1 Edge Reward Point = Re. 0.20.",NA,NA,The cardholder won’t be liable for any fraudulent transactions made on a lost card if the loss is reported to the bank in a timely manner.,"The joining fee is waived on spending Rs. 5,000 within 45 days of card setup & the renewal fee is waived off on spending Rs. 1,00,000 in the previous year.",NA,3.5% on all foreign currency transactions,3.4% per month ( 40.80 per annum),A 1% fuel surcharge waiver on purchasing fuel worth between Rs. 400 – Rs. 4000 at all petrol pumps across India.,2.50% subject to a minimum charge of Rs. 500,NA,"Visit the Axis Bank’s official website.
Click on the option ‘Explore Products.’
Under ‘Cards,’ select ‘Credit Cards.’
Choose the Platinum Credit Card & click on Apply Now.
Proceed further accordingly by providing the required details.",NA
Axis Bank My Wings Credit Card,Travel,"Rs. 1,200 (plus applicable taxes)","Rs. 1,200 (plus applicable taxes)",2 complimentary base fare domestic flight tickets via Ezeego1.,4 EDGE Points for every Rs. 200 spent with the card,"Complimentary domestic lounge access, cashback/discount on flight/rail/bus tickets and car rentals",1 complimentary domestic lounge access per quarter,NA,Minimum 15% off on dining at partner restaurants,EDGE Points earned are redeemable for shopping/travel vouchers or products (from the given catalog) on the EDGE Rewards portal.,NA,NA,Cardholder not liable for any fraudulent transaction made with the card post reporting the loss of card to the bank.,NA,NA,3.50% of the transaction amount,3.40% per month (49.96% per annum),"1% fuel surcharge waived off at all filling stations across India for transactions between Rs. 400 and Rs. 4,000 (max waiver capped at Rs. 400 per month)",2.50% or a minimum of Rs. 500,NA,NA,NA
Axis Bank Titanium Smart Traveler Credit Card,Travel,Rs. 250,Rs. 250,NA,"8 Edge Rewards on every Rs. 200 spent on international spends, 4 Edge Rewards on every Rs. 200 spent on hotels, bus/train bookings, hotel packages, airlines bookings in India, and 2 Edge Rewards on every Rs. 200 spent elsewhere.",NA,NA,NA,Get up to 15% off on restaurant spends with exclusive partner restaurants in India.,You can redeem the reward points accumulated on the Product Catalog of the Axis EDGE REWARDS portal. 1 Edge Reward = Re. 0.20.,NA,NA,The cardholder will not be liable for any fraudulent transactions made on a lost/stolen card post reporting the loss to the bank.,"Joining fee waived off on spending Rs. 2,500 or more within the first 45 days and the renewal fee is waived off on spending Rs. 50,000 or more in the preceding year.",NA,3.5% on all foreign currency spends,3.4% per month,"1% fuel surcharge waiver on all fuel transactions between Rs. 400 & Rs. 4,000.",2.5% on withdrawal amount subject to minimum charge 0f Rs. 500,NA,NA,NA
Axis Bank Pride Signature Credit Card,"Travel , Shopping",NA,NA,NA,"For every Rs. 200 spent, you will get 8 EDGE REWARD Points.",Complimentary visits to domestic lounges.,"In every calendar quarter, you will get 2 complimentary domestic lounge access.",NA,A discount of 15% or more on dining at partner restaurants.,EDGE REWARD Points can be redeemed at the EDGE REWARDS Portal. 1 EDGE REWARD Point = Rs. 0.20.,NA,NA,"For any fraudulent transaction that takes place through the credit card in case of loss or theft, the cardholder will not be held responsible if the same is reported to the bank within the prescribed time frame.","The renewal fee is waived off on exceeding spends of Rs. 40,000 or more in the preceding year",NA,3.5% of the forex transactions.,2.95% per month (or 41.75% annually),"1% fuel surcharge is waived off on all transactions between Rs. 400 & Rs. 4,000 (max waiver capped at Rs. 400 per month)",2.5% of the withdrawn amount (subject to a minimum charge of Rs. 500),NA,NA,NA
Axis Bank Pride Platinum Credit Card,Dining,NA,NA,NA,4 Reward Points per Rs. 200 spend.,NA,NA,NA,Enjoy delicious cuisine with Axis Bank Dining Delights that offer a minimum of 15% at its partner restaurants all over India.,1 RP = Rs 0.20 for redemption against a variety of options available at the Edge Rewards website.,NA,NA,Zero liability protection for the cardholder against any fraudulent purchases from your card once the card loss is reported.,"The annual fee waiver on spending Rs. 20,000 or more in the preciding year.",NA,3.5% of the transaction value.,2.95% p.m.,"1% waiver on fuel surcharge at all the fuel stations in India for transactions between Rs. 400 and Rs. 4,000 done using Axis Bank Pride Platinum credit card (maximum waiver of Rs. 250 pm).",2.5% of the amount withdrawn or Rs. 500 (whichever is higher),NA,NA,NA
6E Rewards XL – Indigo Kotak Bank Credit Card,Travel,"Rs. 2,500","Rs. 2,500","In the form of welcome benefits, the cardholders will get one complimentary air ticket, Accor hotels’ dining and stay vouchers, and a complimentary 6E prime add-on.","6% 6E Rewards on indigo, 3% 6E Rewards on dining, groceries, and entertainment, and 2% 6E Rewards on other spends.",Get complimentary airport lounge access and discounted convenience fee on Indigo flights.,8 complimentary domestic lounge access every year.,NA,Accelerated 6E Rewards on movie & dining.,The earned 6E Rewards can be redeemed against Indigo bookings at a value of 1 6E Reward = Re. 1.,NA,NA,You won’t be liable for any fraudulent transactions made on a lost/stolen card if reported to the bank in a timely manner.,NA,Rs. 99 on every redemption request,3.5% on all foreign currency spends.,3.50% per month (42% per annum),1% fuel surcharge is applicable on all fuel transactions.,"Rs. 300 on every withdrawal of Rs. 10,000.",NA,NA,NA
6E Rewards – Indigo Kotak Bank Credit Card,Travel,Rs. 700,Rs. 700,"You get a complimentary flight ticket and 6E add-on, Accor hotels stay/dining vouchers, and a Budweiser gift voucher.","3% 6E Rewards on Indigo flights, 2% 6E Rewards on dining, groceries, and entertainment spends, and 1% 6E Rewards on other spends.",Discounted convenience fee on Indigo flights.,NA,NA,Accelerated 6E Rewards on movie and dining spends.,The earned 6E Rewards can be redeemed against Indigo flight bookings at a value of 1 6E Reward = Re. 1.,NA,NA,You won’t be liable for any fraudulent transactions if you report the loss to the bank in a timely manner.,NA,Rs. 99 on every redemption request,3.5% on all foreign currency spends,3.5% per month,The 1% fuel surcharge is applicable on all fuel transactions.,"Rs. 300 on every withdrawal of Rs. 10,000 or less.",NA,NA,NA
Kotak White Reserve Credit Card,Shopping,"Rs. 12,500 (plus applicable taxes)","Rs. 12,500 (plus applicable taxes)",NA,White Pass Value will be earned for Reward Points on crossing a minimum spend of Rs. 3 Lakhs,Complimentary access to lounges at 1000+ airports around the world,Complimentary lounge access at domestic airports,NA,Get up to 20% off on dining bills at participating Marriot hotels across the Asia Pacific Region,"The White Pass Value can be redeemed against various vouchers, flights, and hotels, etc available at www.kotakbankwhite.com. The White Pass Value can also be redeemed for cash.",2 Golf Rounds each month at selected golf courses around the world,Complimentary lounges access at international airports,Zero Liability Protection is provided against lost/stolen credit cards upon reporting to the customer care of the bank.,"The renewal fee can be waived off on spending Rs. 10,00,000 or more in the previous year.",NA,2% on all international transactions,3.5% per month (or 42% annually),1% at all fuel stations in India,"Rs. 300 for every Rs. 10,000 withdrawn or part thereof",NA,NA,NA
Kotak 811 Credit Card,Shopping,Rs. 500 (plus applicable taxes),Rs. 500 (plus applicable taxes),"500 Bonus Reward Points on expenditure of Rs. 5,000 within 45 days of card issuance.",1 Reward Point per Rs. 100 on offline spends and 2 Reward Points per Rs. 100 on online spends.,NA,NA,"Lost card cover worth Rs. 50,000 applicable 7 days prior to reporting the loss of card","Option to get 4 PVR tickets on spending Rs. 75,000 in a year.","Reward Points redeemable for mobile recharges, shopping vouchers, gift cards, movie and travel vouchers at Kotak Rewards portal.",NA,NA,Cardholder shall not be liable for any fraudulent transaction made on the card post reporting the loss of the card to the bank.,"Annual fee waived off on spending a minimum of Rs. 50,000 in the preceding year.",NA,3.5% of the transaction amount,3.5% per month (or 42% annually),"1% fuel surcharge waived off on transactions between Rs. 500 and Rs. 3,000 (max waiver capped at Rs. 3,500 per annum).","Rs. 300 per Rs. 10,000 withdrawn",Rs. 200 (plus applicable taxes),NA,NA
Kotak Royale Signature Credit Card,"Travel , Shopping",NA,NA,NA,"2 Reward Points per Rs. 150 you spend. 4 Reward Points per Rs. 150 you spend on select categories like restaurants, international spends, Airlines, hotels, etc.",You get complimentary airport lounge access every year.,2 complimentary access to domestic lounges per quarter,Coverage of Rs. 2.5 lakhs against fraudulent transactions on a lost/stolen card.,NA,The Reward points are redeemable on https://kotakrewards.com/ against various categories. 1 RP = 18.75 paise.,NA,NA,The cardholder will not be held as liable for any fraudulent transactions done if the card is reported lost or stolen to the bank.,"The renewal fee can be waived if you Rs. 1,00,000 or more in the preceeding year.",NA,3.5% on all foreign currency spends,3.4% per month,1% fuel surcharge is waived at all fuel stations.,"Rs. 300 per Rs. 10,000 withdrawn",NA,NA,NA
Kotak Zen Signature Credit Card,"Travel , Shopping",Rs 1500 plus applicable taxes,Rs 1500 plus applicable taxes,Get 1500 Zen Points on payment of joining fees,You can earn up to 15 Zen Points on every Rs 150 spent on KayMall. You can earn up to 5 Zen Points on every Rs 150 on all other categories,Complimentary Lounge Access Worldwide,8 Complimentary Domestic Lounge Access every year. You can avail yourself up to 2 lounge access every quarter calendar at select airport lounges with Visa Airport Lounge Access Program,NA,NA,"1 Zen Point = Rs 0.25  redemption with the Kotak Reward program, you can redeem these reward points for exclusive vouchers and special discounts on partner deals and offers. You also can redeem these reward points and convert them into cash to pay for your shopping spends at partner merchant outlets",NA,3 Complimentary International Lounges with Priority Pass Membership.,NA,"You can get an annual fee waiver of Rs 1500 on the spending of Rs 1,50,000",NA,3.5% on the conversion amount,3.4% per month (40.80 per annum),1% fuel surcharge waiver on transactions between Rs 500 and Rs 3000,Rs 300 on the withdrawal amount,Rs 299/-,NA,NA
Kotak Privy League Signature Credit Card,Shopping,"Rs. 2,500 + GST (for paid variant), NA (for free variant)","Rs. 2,500 + GST (for paid variant), NA (for free variant)",NA,"5x Reward Points on select retail shopping and travel spends, 2x Reward Points on all other spends and traveler’s plan.","Complimentary domestic lounge access, Priority Pass membership, 4 complimentary lounge visits / year visits with Priority Pass (paid variant only)","Under the Domestic Visa Lounge Program, you will get complimentary access to domestic lounges.",NA,NA,Reward Points redeemable on Kotak reward redemption portal.,NA,"Complimentary Priority Pass membership (with both variants), 4 complimentary lounge visits every year visits with Priority Pass (paid variant only)",Zero liability against fraudulent transactions if loss or theft is reported to the bank within the specified time frame.,The annual membership fee will be waived off if the cardholder spends Rs. 5 lakh in the preceding year or by maintaining Insignia or True Optima Banking Relationship,NA,2% for paid variant and 3.5% for the free variant (exclusive of GST),2.49% per month (29.88% annually),Waived,"Rs. 300 per Rs. 10,000 withdrawn or part thereof",NA,NA,NA
Kotak Mojo Platinum Credit Card,"Travel , Shopping","Rs. 1,000","Rs. 1,000",NA,1 Mojo Point on every Rs. 100 spent. 2.5 Mojo Points on every online spend of Rs. 100. 5 Mojo Points on every Rs. 100 on KayMall.,Get complimentary airport lounge access every year,2 complimentary domestic lounge access every quarter.,Insurance cover worth Rs. 1.25 lakhs against unauthorized transactions on a lost/stolen card,NA,The Mojo Points you earn can be redeemed against various categories at kotakrewards.com at a rate of 1 Mojo Point = Rs. 0.25.,NA,NA,Zero liability protection against a lost/stolen card is provided if the loss is reported to the bank in a timely manner.,"The joining fee is waived off on spending Rs. 30,000 or more within the first 90 days and the renewal fee is waived off on spending Rs. 1 lakh or more in the previous year.",NA,3.5% on all the foreign currency transactions,3.5% per month,"You get a 1% fuel surcharge waiver across all fuel stations for all fuel transactions between Rs. 500 & Rs. 3,000","Rs. 300 for every withdrawal of Rs. 10,000",Rs. 299,"Proof of Identity: PAN Card, Aadhar Card, Driving License, Passport, Voter’s Id, etc.
Proof of Address: Aadhar Card, Ration Card, Latest water/electricity bills, rent agreement, etc.
Proof of Income: Latest months’ salary slips/bank statements or latest audited ITR.",NA
Kotak League Platinum Credit Card,Movies,Rs. 500 plus applicable taxes,Rs. 500 plus applicable taxes,Get a movie voucher worth Rs 500 on payment of the joining fee,You get 8x reward points for every 150 spent on special categories and  4x reward points on every 150 spent on other categories up to 2 lacs. You 8x reward points on every Rs 150 spent on special categories and other categories above Rs 2 lacs.,NA,NA,NA,Get a movie voucher from BookMyShow.com worth Rs 500,You can redeem the reward point accumulated at the Kotak rewards portal. You can use the Pay with Points facility provided by the bank at the partner merchant store.,NA,NA,"Get a protection liability up to Rs 1,25,000 in case of theft or loss of card up to 7 days","Get spend based waiver on the annual fee of Rs 500 on annual spending of Rs 50,000.",NA,3.5% on the conversion amount,3.50% per month (42% per annum),1% fuel surcharge waiver on your fuel transactions between Rs 500 and Rs 3000,Rs 300 on the withdrawal amount,NA,NA,NA
PVR Kotak Platinum Credit Card,Movies,NA,NA,NA,NA,NA,NA,Insurance cover in case the card is lost/stolen.,Get a cashback of 15% on food & beverages and a 5% cashback on movie tickets at PVR.,The free PVR movie tickets you get can be redeemed either by sending an SMS to the bank’s customer care or by the net banking option available on the bank’s website.,NA,NA,Zero liability after reporting the loss of card to the bank’s customer care.,NA,NA,3.5% on all foreign currency spends,3.5% per month,1% fuel surcharge is applicable at all fuel stations,"Rs. 300 per withdrawal of Rs. 10,000",Rs. 299 for every add on card,NA,NA
Kotak Essentia Platinum Credit Card,Shopping,"Rs. 1,499 + GST","Rs. 1,499 + GST",NA,10 Saving Points/Rs. 100 on purchases made at grocery and departmental stores and 1 Saving Point/Rs. 250 on all other spends,NA,NA,Insurance cover worth Rs. 1.25 lakh against unauthorized transactions up to 7 days prior to reporting the loss of card.,"6 movie tickets by PVR on the expenditure of Rs. 1,25,000 in 6 months.","Saving Points redeemable on Kotak Rewards portal for travel-related spends, shopping, mobile recharge,  shopping vouchers and movie tickets. The Saving Points can also be used as cash (1 Point = Re. 1) at partner merchants.",NA,NA,"Cardholder not liable for any fraudulent transaction of up to Rs. 1,25,000 up to 7 days prior to reporting the loss of card.",NA,NA,3.5% + GST,3.50% per month or 42% annually,"Applicable, subject to a minimum surcharge of Rs. 10","Rs. 300 per Rs. 10,000 (or part thereof) withdrawn.",Rs. 299/card,NA,NA
PVR Kotak Gold Credit Card,Movies,NA,NA,NA,NA,NA,NA,NA,"Get 2 free PVR movie tickets worth up to Rs. 400 each on spending Rs. 15,000 or more in a month.",The movie tickets can be redeemed by logging in to kotak.com or by sending an SMS,NA,NA,"Zero Liability protection & card insurance worth Rs 50,000 is provided in the case of the lost or stolen card if reported in a timely manner.",NA,NA,3.5% on all foreign currency spends,3.5% per month,1% fuel surcharge fee will be applicable.,Rs. 300,Rs. 299 per add-on card,NA,NA
Kotak 811 #DreamDifferent Credit Card,Shopping,Rs. 500 (plus applicable taxes),Rs. 500 (plus applicable taxes),"500 Bonus Reward Points on expenditure of Rs. 5,000 within 45 days of card issuance.",1 Reward Point per Rs. 100 on offline spends and 2 Reward Points per Rs. 100 on online spends.,NA,NA,"Lost card cover worth Rs. 50,000 applicable 7 days prior to reporting the loss of card","Option to get 4 PVR tickets on spending Rs. 75,000 in a year.","Reward Points redeemable for mobile recharges, shopping vouchers, gift cards, movie and travel vouchers at Kotak Rewards portal.",NA,NA,Cardholder shall not be liable for any fraudulent transaction made on the card post reporting the loss of the card to the bank.,"Annual fee waived off on spending a minimum of Rs. 50,000 in the preceding year.",NA,3.5% of the transaction amount,3.5% per month (or 42% annually),"1% fuel surcharge waived off on transactions between Rs. 500 and Rs. 3,000 (max waiver capped at Rs. 3,500 per annum).","Rs. 300 per Rs. 10,000 withdrawn",Rs. 200 (plus applicable taxes),NA,NA
Kotak White Credit Card,Shopping,"Rs. 3,000 + GST","Rs. 3,000 + GST","Voucher worth Rs. 1,500 on spending Rs. 30,000 withing 60 days of card setup",Earn Reward Points as White Pass value post crossing the expenditure milestone of Rs. 2 lakh,"8 complimentary domestic lounge access annually (2/quarter), 4 complimentary international lounge access every year with Priority Pass",8 complimentary domestic lounge access every year (2/quarter),Cover against unauthorized use of card worth Rs. 2.5 lakh,NA,White Pass value redeemable for vouchers from partner brands,NA,4 complimentary international lounge access annually with Priority Pass,Cover worth Rs. 2.5 lakh from 7 days prior to reporting the loss of card,Annual fee waived on expenditure of Rs. 5 lakh in the preceeding year,NA,3.5% + GST,3.1% per month (37.2% annually),"Waived for transactions between Rs. 500 and Rs. 3,000 (max waiver of Rs. 3,500/year)","Rs. 300 per Rs. 10,000 (or part thereof) withdrawn.",NA,NA,NA
Kotak Urbane Gold Credit Card,Shopping,NA,NA,NA,3x Reward Points per Rs. 100 you spend on all retail transactions,NA,NA,Insurance cover for a lost or stolen card,NA,"Redeem the earned points for various categories like Movie Tickets, Mobile Recharge, etc. Rewards Points can used to pay your shopping bills through PayByPoints Program",NA,NA,Zero Liability Protection for a lost or stolen credit card upon reporting to the bank’s customer care.,"Get the annual fee waived on spending Rs. 15,000 in the previous year.",NA,3.5% on all foreign transactions,3.5% per month (or 42% annually),NA,"Rs. 300 per Rs. 10,000 withdrawn",NA,NA,NA
Kotak Veer Select Credit Card,Shopping,NA,NA,"Complimentary IHO membership worth Rs. 8,500 on spending Rs. 500 within the first 30 days of card issuance.","3 Reward Points on every spend of Rs. 200, and 3x Reward Points on movies, dining, and departmental stores.",Complimentary access to domestic airport lounges,2 complimentary domestic airport lounge access every quarter,Insurance cover worth Rs. 2.5 lakhs against unauthorized transactions on a lost/stolen card,NA,"Redeem points against a host of categories such as Movies, Mobile Recharges, and e-vouchers. 1 Kotak Reward Point = Re. 0.25.",NA,NA,Zero liability protection against a lost/stolen card is provided to the cardholder if the loss is reported to the bank immediately.,"On spending Rs. 1,00,000 on retail purchases, the annual fee for the next year is waived.",NA,3.5%,3.5% per month (42% annually),1% fuel surcharge waiver across all petrol pumps (capped at Rs. 3500 annually),"Rs. 300 per withdrawal of Rs. 10,000.",NA,NA,NA
Kotak Veer Platinum Credit Card,Shopping,NA,NA,500 Reward Points if you spend Rs. 500 in the first 30 days of card set-up,"6 Reward Points per Rs. 200 spent on grocery, dining, etc and 2 Reward Points for other spends",NA,NA,Insurance cover for a lost or stolen card,NA,"The reward points are redeemable for various categories like Movie Tickets, Mobile Recharge, etc. 1 Reward Point = Re.0.25.",NA,NA,Zero Liability Protection to the cardholder against any transactions done on a lost or stolen card post reporting to the bank,"Annual fee waiver on spending Rs. 50,000 or more in a year.",NA,3.5% on all foreign transactions,3.5% per month (or 42% annually),1% at all fuel stations in India,"Rs. 300 is charged for every Rs. 10,000 withdrawn",NA,NA,NA
Kotak Bank Fortune Gold Card,Shopping,NA,NA,NA,NA,NA,NA,NA,Get free movie tickets for any show and any given day at your nearest PVR cinemas,NA,NA,NA,NA,NA,NA,3.5% per foreign conversion,3.5% per month,1% fuel surcharge waiver on transactions between Rs. 500 and Rs. 3000,Rs 199,Rs 299 per add-on card,NA,NA
Metro Kotak Credit Card,Shopping,NA,NA,"Rs. 500 cashback on making a single transaction worth Rs. 10,000 or more within the first 30 days.","Up to 1% cashback on monthly spends above Rs. 10,000 with this card.",NA,NA,NA,NA,The cashback is directly credited to the cardholder’s accounts.,NA,NA,The cardholders are not liable for any fraudulent transactions made through a lost/stolen card if the loss is reported to the bank in a timely manner.,NA,NA,NA,3.5% per month,NA (fuel transactions are not applicable to this card),"Rs. 300 for every withdrawal of Rs. 10,000",NA,NA,NA
ICICI Bank Sapphiro Credit Card,"Travel , Shopping","Rs 6,500 (plus applicable taxes)","Rs 6,500 (plus applicable taxes)","Exclusive travel & shopping gift vouchers worth more than Rs. 9,000 (From Tata CliQ, EaseMyTrip, Uber, Zomato Pro, Croma) with the Visa & Mastercard variants and get an extra cashback of Rs. 750 on spending Rs 20,000 within 60 days of issuance with the AmEx variant.","On every Rs. 100 spent, get 4 Reward Points per Rs. 100 spent on international purchases & 2 Reward Points on domestic purchases.",Complimentary Domestic &  International Airport Lounge visits and complimentary Spa Sessions at select Domestic airports under the Dreamfolks Membership Programme.,"2 complimentary domestic lounge visits with the MasterCard & Amex variant each, and 4 complimentary domestic lounge access with the Visa variant.","Air accident insurance (worth Rs 3 crores), Credit Shield Cover worth Rs 50,000 and other travel-related Insurance Covers.",Get Rs. 500 off on the second movie or event ticket when you buy one ticket from Book My Show.,Redeem reward points earned for cash back or gifts at a rate of 1 RP = Re. 0.25.,Complimentary golf rounds/lessons every quarter,2 complimentary International Airport Lounge Access every year through the Dreamfolks membership.,"Lost card liability (worth Rs. 50,000) is applicable from 2 days prior to reporting and till 7 days after reporting the loss to the ICICI Bank.",Renewal fee waiver on spending Rs 6 Lakhs annualy.,Rs. 99 (plus applicable taxes) per redemption request,3.50% of the total transaction value.,3.4% per month (or 40.8% per annum),1% of Fuel Surcharge Waiver (Maximum Rs 250 per billing cycle) at all fuel stations in India.,2.5% of the total transaction amount (minimum Rs. 300),NA,"To redeem your Reward Points against cash, make a call on 080-40146444. Your points will be credited as cash credit into your account within 7 days from the redemption request.
For redemption against gifts, call on 1860-258-5000. The gift of your choice will be sent to you within 10 working days.",ICICI Sapphiro Credit Card Login/Net Banking
