SBI Prime Credit Card,"Travel , Shopping","Rs. 2,999 (plus applicable charges)","Rs. 2,999 (plus applicable charges)","Gift voucher (worth Rs. 3,000) from any of these brands, Yatra, Aditya Birla Fashion, Bata/Hush Puppies, Shoppers Stop, and Pantaloons.","10 Reward Points for every spend of Rs. 100 on groceries, dining, movie and departmental store, 2 RPs for every Rs. 100 spent on all other retail.","Complimentary Trident Privilege Red Tier Membership, Complimentary Club Vistara Silver membership, & complimentary international and domestic airport lounge visits.",8 complimentary domestic airport lounge visits per annum (max visits 2 per quarter),"Air accident cover (worth Rs. 50 lakhs), fraud liability cover (worth Rs. 1 lakh) applicable from 48 hours prior to 7 days post reporting about the loss of the card to the bank",5X Reward Points (10 Reward Points) on dining and movie spends,Redeem reward points on Sbicard.com for gift vouchers or for settling the card’s statement balance.,Complimentary 4 rounds of green fee and 1 complimentary golf lesson every month and also up to 50% off on golf games (With MasterCard Variant only),4 complimentary international airport lounge access every year with Priority Pass Membership (2 per quarter),Fraud liability cover (worth Rs. 1 lakh) applicable from 48 hours prior to 7 days post reporting the loss of card to the bank,Renewal fee is waived off if a minimum of Rs. 3 lakhs were spent in the previous year,Rs. 99 (plus applicable taxes) per redemption request,3.5% of the transaction amount,3.5% per month (42% per annum),"1% fuel surcharge waiver applicable on every fuel transaction between Rs. 500 to Rs. 4,000 (maximum waiver of Rs. 250 in a month).",2.5% of the amount withdrawn or Rs. 500 (whichever is higher),NA,"The joining & renewal fee for the SBI Card Prime is Rs. 2,999 (plus applicable taxes). You can’t get the joining fee waived, but the renewal fee of Rs. 2,999 can be waived off on spending Rs. 3 lakhs or more in the last year.
If the cardholder is not able to settle the outstanding bill before the due date, interest charges of 3.5% per month (42% annually) would be charged on the due amount.
The cash advance fees on the SBI Card Prime is 2.5% of the cash amount withdrawn subject to a minimum of Rs. 500. This fee is applicable whenever you withdraw cash using SBI Card Prime.
The card charges 3.5% of the transaction amount as foreign currency markup for purchases made in a different currency.",SBI Card Prime Bill Payment
Cashback SBI Card,Shopping,NA,NA,NA,5% cashback for every online transaction and 1% cashback on other offline transactions and utility bill payments,Complimentary access to airport lounges.,4 complimentary access to domestic airport lounges (1 per quarter).,NA,NA,Cashback earned with the card will be automatically credited to next month’s statement.,NA,NA,The cardholder will not be liable for any fraudulent transaction if the card is reported lost or stolen to the bank in a timely manner.,"The annual fee can be waived on spending Rs. 2,00,000 or more in the previous year.",NA,3.5% of the international transaction,3.5% p.m. (42% p.a.),"1% fuel surcharge waiver for transactions between Rs. 500 and Rs. 3,000 at petrol pumps across India. (waiver capped at Rs. 100 per statement)",2.5% of the amount withdrawn or a minimum charge of Rs. 500.,NA,NA,NA
SBI SimplyCLICK Credit Card,Shopping,Rs. 499 (plus applicable taxes),Rs. 499 (plus applicable taxes),Get an Amazon e-voucher worth Rs. 500 as welcome benefits after paying the annual fees.,"1 Reward Point every Rs. 100 spent on offline spends (reward rate is 0.25%), 10X RPs on online spends at partner merchants (BookMyShow, Apollo24x7, etc.) (reward rate is 2.5%), 5X RPs on other online spends (reward rate = 1.25%)",NA,NA,NA,NA,"Reward Points can be redeemed for gift vouchers on sbicard.com or via the SBI mobile app, as well as for paying the card’s outstanding balance, 1 RP = Rs. 0.25",NA,NA,The cardholders get a zero liability protection against a lost/stolen card if the loss is informed to the bank officials timely.,Get a renewal fee waiver on achieving total annual spends of Rs. 1 lakh in previous year.,Rs. 99 (plus taxes) on each redemption request,3.5% of the total transaction amount,3.5% per month or 42% annualized,"1% fuel surcharge waived on fuel transactions from Rs. 500 to Rs. 3,000 (max waiver capped at Rs. 100 per month)",2.5% of the withdrawal amount or a minimum fee of Rs. 500,NA,"Visit the SBI Card’s official website.
Click on the option ‘Credit Cards.’
Scroll down and at the very end of the page, you will see an option ‘Track Application.’ Click on that.
Enter the application number that was sent to your registered mobile number and click on ‘Track.’
The status of your card application will be there on your screen in seconds.",SBI Simply CLICK Credit Card Bill Payment
SBI SimplySAVE Credit Card,Shopping,Rs. 499 (plus applicable taxes),Rs. 499 (plus applicable taxes),"2,000 Reward points (worth Rs. 500) on spending Rs. 2,000 or more in first 60 days of card set-up.","1 Reward Point for Rs. 100 spent (reward rate = 0.25%), 10X RPs for spends made in movies, grocery, dining, & departmental stores (reward rate = 2.5%)",NA,NA,NA,10X Reward Points on movie and dining spends,"Redeem points earned for gift vouchers on sbicard.com or SBI mobile app. Also, for paying the card’s outstanding balance. (1 Reward Point = Rs. 0.25)",NA,NA,"On reporting the loss of the card to the bank within the stipulated time, the card holder will not be liable for any transaction done on the card.",Renewal fee can be waived off on incurring Rs. 1 lakh in the previous year,Rs. 99 (plus applicable taxes) per redemption request,3.5% of the transaction amount,3.50% per month (or 42% annually),"1% fuel surcharge waiver on transactions between Rs. 500 and Rs. 3,000 (capped at Rs. 100 per month)",2.5% of the amount withdrawn or Rs. 500 (whichever is higher),NA,"Visit the official website of the bank at SBI Card.
Click on ‘New User? Register Now.’
Now, enter the required details, which include your card number, CVV, and Date of birth.
Enter that OTP received on the mobile number which is registered with your card to complete the verification process.
After successful verification, you will need to enter your username and password and then click on confirm.
Now your card is registered for net banking.",SBI SimplySAVE Credit Card Bill Payment
SBI Card PULSE,Shopping,"Rs. 1,499 (plus applicable taxes)","Rs. 1,499 (plus applicable taxes)","A Noise ColorFit Pulse Smart Watch worth Rs. 5,000, complimentary Fitpass Pro membership, and complimentary Netmeds First membership.","10 Reward Points per Rs. 100 spent on Pharmacy, Chemist, movie & dining and 2 RPs per Rs. 100 spent elsewhere.",Get complimentary access to domestic lounges alon with Priority Pass membership.,2 complimentary domestic lounge visits per quarter.,"Get an air accident cover of Rs. 50 lakhs, zero liability cover of Rs. 1 lakh, and other travel insurance covers, including lost baggage, delayed baggage, loss of travel documents, etc.",NA,The Reward points are redeemable against a host of options on the Rewards catalogue or against the statement balance (1 RP = Re. 0.25).,NA,NA,The liability for a fraudulent transaction done on the lost or stolen card will not fall on the cardholder if he/she reports the same to the bank in a timely manner.,The renewal fee can be waived if you spend Rs. 2 lakhs or more in the previous year.,Rs. 100 on each redemption request,3.5% of the transaction amount,3.50% per month (42% per annum),"1% fuel surcharge waiver for all fuel transactions between Rs. 500 and Rs. 4,000.",2.5% of the cash amount subject to a minimum of Rs. 500,NA,"Visit the official website of SBI Card.
You will see the ‘Apply’ section and click on ‘Apply Now.’
Select the ‘SBI Card Pulse’ and click on apply now again.
Now, fill in all the required details, complete all the formalities and proceed further.",NA
BPCL SBI Card Octane,Fuel,"Rs. 1,499 (plus applicable taxes)","Rs. 1,499 (plus applicable taxes)","6,000 bonus RPs as a joining benefit, and every year the membership is renewed (provided the annual fee is paid).","25 reward points for every Rs. 100 spends at BPCL fuel stations (reward rate = 6.25%), 10 RPs for every Rs. 100 spends on groceries, departmental stores, and movie ticket purchases (reward rate = 2.5%), and 1 reward point for every Rs. 100 spent for all other expenditures (reward rate = 0.25%) except mobile wallet uploads and fuel purchases at non-BPCL stations.",Complimentary domestic airport lounge visits,4 complimentary access to domestic lounges every year (1 per quarter).,NA,10x reward points for every Rs. 100 you spend on dining and movie tickets.,"Redeem reward points for gift vouchers on sbicard.com or on SBI mobile app, for transactions at BPCL petrol stations, and against card’s statement balance. 4 reward points = Re. 1.",NA,NA,No liability to the cardholder if the loss of the card is reported to the bank within stipulated time.,Next year’s renewal fee waived on annual expenditure of Rs. 2 lakh.,Rs. 99 (plus applicable taxes) per redemption request.,3.5% of the transaction amount,3.5% per month (42% per annum),"1% fuel surcharge waiver on transactions up to Rs. 4,000 (max waiver of Rs. 100 in a month)",2.5% of the withdrawn amount (subject to a minimum charge of Rs. 500),NA,NA,NA
BPCL SBI Credit Card,Fuel,Rs. 499 (plus applicable taxes),Rs. 499 (plus applicable taxes),"2,000 Activation Bonus Reward Points worth Rs. 500 on payment of joining fee (credited after 20 days of the payment of joining fee).","1 Reward Point per Rs. 100 (reward rate = 0.25%), 5x RPs on dining, movies, departmental stores, and groceries (reward rate = 1.25%), 13X RPs at BPCL pumps (reward rate = 3.25%)",NA,NA,NA,5X Reward Points on movie and dining spends,"Reward Points redeemable against gift vouchers on sbicard.com or on SBI mobile app, for purchases at BPCL petrol stations and against cash (card’s statement balance). 4 Reward Points = Re. 1.",NA,NA,Cardholder shall not be liable for any fraudulent transaction made on the card post reporting the loss of card to the bank.,"Renewal fee is waived off on a minimum spend of Rs. 50,000 in an anniversary year.",Rs. 99 (plus applicable taxes) per redemption request,3.5% of the transaction amount,3.5% per month (42% per annum),"1% fuel surcharge waived off at all fuel stations across India for transactions up to Rs. 4,000 (max waiver capped at Rs. 100 per month)",2.5% of the withdrawn amount (subject to a minimum charge of Rs. 500),NA,NA,NA
Air India SBI Signature Credit Card,Travel,"Rs. 4,999 (plus applicable taxes)","Rs. 4,999 (plus applicable taxes)","You will get 20,000 reward points in the form of a welcome benefit.",30 RP for every Rs. 100 spent on tickets booked for self and 10 RPs for every Rs. 100 spent on tickets booked for others through airindia.in and 10 RPs for every Rs. 100 spent on tickets booked for self and others through Air India Booking office or call centers,"Reward Points convertable into Air India Air Miles, accelerated reward points on Air India spends, complimentary domestic and international airport lounge access","Complimentary visits to domestic lounges, up to 8 times a year.",Insurance cover worth Rs. 1 Lakhs against the lost card.,NA,The reward points that the cardholders earn can be converted into Air India Air Miles. 1 Reward point = 1 AirMile,NA,Complimentary Priority Pass membership (visits chargable),Zero liability of credit cardholder against fraudulent transaction on the card post reporting the loss of card to the bank,NA,Rs. 99 (plus applicable taxes),3.5% of the amount transacted,3.5% per month (or 42% annually),"Fuel surcharge waiver of 1% on fuel transactions between Rs. 500 and Rs. 4,000.",2.5% or Rs. 500 (whichever is higher),NA,NA,NA
Club Vistara SBI Card PRIME,Travel,"Rs. 2,999 (plus applicable taxes)","Rs. 2,999 (plus applicable taxes)",1 complimentary Premium Economy class ticket as a gift voucher on payment of the joining/renewal fee.,"4 CV (Club Vistara) points/Rs, 200 for every spend, including fuel transactions.","1 Premium Economy Class ticket each on the annual expenditure of Rs. 1.5 lakh, 3 lakh, 4.5 lakh and 8 lakh, complimentary domestic as well as international lounge visits, discounts on car rentals, hotel bookings, and destination programs in Japan, Korea, Macau and Singapore.",8 complimentary access to domestic lounges (2 per quarter),"Insurance cover for up to 6 flight ticket cancelations per year (each limited to Rs. 3,500), air accident cover up to Rs. 1 crore, and insurance of up to Rs. 72,000 for loss of check-in baggage, Rs. 7,500 if the baggage is delayed, Rs. 5,000 if the baggage is damaged, and a cover of Rs. 12,500 in case you lose your baggage during air travel.",NA,"Club Vistara Points can be redeemed for booking award flights, class upgrades, or against any seat reservation under the Vistara Cash + Points program (1 CV Point = Rs. 0.2)",NA,4 complimentary visits per year (max 2 per quarter) with Priority Pass membership.,Up to Rs. 1 lakh Lost card liability protection from 48 hours prior to reporting the loss of card till 7 days post reporting the loss to the bank.,None,NA,3.5% (plus applicable taxes),3.5% per month (42% per annum),"1% fuel surcharge applicable, subject to a minimum amount of Rs. 10.",2.5% of the withdrawn amount (subject to a minimum charge of Rs. 500),NA,NA,NA
Air India SBI Platinum Credit Card,Travel,"Rs. 1,499 (plus applicable taxes)","Rs. 1,499 (plus applicable taxes)","5,000 reward points after paying the joining fee (credited within 15 days from the date of payment)","15 reward points for every Rs. 100 spent on Air India ticket bookings for self on airindia.in, 5 RPs for every Rs. 100 spent on Air India ticket bookings for others on airindia.com and 5 RPs for every Rs. 100 spent on Air India ticket bookings for self or others via Air India call centers or booking offices, Get 2 Reward points per Rs. 100 you spend.",Complimentary access to domestic lounges,8 complimentary visits to domestic lounges every year (max 2 per quarter),Lost card liability protection of Rs. 1 lakh applicable from 48 hours prior to 7 days post reporting about the card to the bank.,NA,Reward points are convertible into Air India Air Miles. 1 RP = 1 AirMile,NA,NA,No liability to the cardholder once the card is reported lost to the bank.,NA,NA,3.5% (plus applicable taxes),3.5% per month (or 42% per annum),"1% fuel surcharge waiver at fuel stations all over India on transactions between Rs. 500 and Rs. 4,000 (capped at Rs. 250).",2.5% (minimum of Rs. 500),NA,NA,NA
Club Vistara SBI Card,Travel,"Rs 1,499 (plus applicable taxes)","Rs 1,499 (plus applicable taxes)",1 economy class air ticket e-voucher as a complimentary gift and Club Vistara Base membership,3 CV (Club Vistara) Points per Rs 200 you spend.,Complimentary Domestic lounge access and Air Vistara tickets as milestone benefits.,4 complimentary access to domestic lounges annually (max 1 visit every quarter),"Air accidents cover up to Rs 50 lacs.
Loss of check-in baggage cover of Rs 72000.
Loss of travel documents cover of Rs 12500.
Cover against 4 flight cancellations in a year each limited to Rs 3500.
Baggage damage cover up to Rs 2,500.",NA,Reward Points directly transferred to Club Vistara account.  You can redeem the accumulated CV Points for flights on Air Vistara and partner airlines.,NA,Complimentary Priority Pass Membership,"Zero liability cover up to Rs. 1 lakh, provided the card is reported lost to the bank within 48 hours.",None,NA,3.5% on the transaction amount,3.50% per month (42% per annum),NA,2.5% of amount withdrawn (minimum charge of Rs 500/-),NA,NA,NA
Etihad Guest SBI Premier Card,Travel,"Rs. 4,999 (plus applicable taxes)","Rs. 4,999 (plus applicable taxes)","5,000 Etihad Guest Miles, 2 Free Wifi vouchers on first Etihad Airways booking, complimentary Etihad Guest Gold tier status post first card transaction,","6 Etihad Guest Miles per Rs. 100 you spend on Etihad.com, 4 Etihad Guest Miles on every Rs. 100 you spend on international purchases, and 2 Etihad Guest Miles for every other spend (except fuel purchases). A max of 40,000 Miles per year can be earned.","Complimentary Etihad Gold Tier status and 5,000 Etihad Guest Miles as a Welcome Benefit, complimentary domestic and international lounge access, up to 10% discount on direct Etihad Airways bookings, up to 10% discount on travel rewards and miles redemption, 1,500 Etihad Guest Miles on spends of Rs. 1,50,000 in a calendar quarter, 1 Etihad Companion Voucher on the annual expenditure of Rs. 8,00,000.",8 domestic lounge access each year with a quarterly cap of 2 visits.,"Overseas air accident cover worth Rs. 50 lakh, fraud liability cover worth Rs. 1 lakh, and an allowance of USD 1,000 in case of loss of baggage.",NA,"The Etihad Guest Miles earned are redeemable for booking hotels, flights, and renting cars from participating travel partners, and for purchasing products on etihadguest.com or its travel partner services. Etihad Miles can also be used to pay for purchases made using the credit card.",NA,Complimentary Priority Pass membership worth USD 99 with 4 complimentary lounge access outside India (max 2 per quarter). Visits chargeable at USD 27/visit/guest post this complimentary quota.,Fraud liability cover of Rs. 1 lakh applicable from 48 hours prior to reporting and 7 days post reporting the loss of card.,"Next year’s annual membership fee waived on the expenditure of minimum Rs. 5,00,000 in a year.",NA,3.5% (plus applicable taxes),3.5% per month (42% per annum),"The 1% fuel surcharge waiver at all fuel stations across India for transactions between Rs. 500 and Rs. 4,000 (capped at Rs. 250 per statement cycle)",2.5% of the withdrawn amount (subject to a minimum charge of Rs. 500),NA,"If you are a salaried employee, your age should be between 18 years to 65 years.
If you are a self-employed individual, your age should lie between 21 years and 60 years.
You should have a stable source of income.
You should have a good credit score.",Etihad Guest SBI Card Premier Login/Internet Banking
Etihad Guest SBI Card,Travel,"Rs. 1,499 (plus applicable taxes)","Rs. 1,499 (plus applicable taxes)","2,500 Etihad Guest Miles, Etihad Guest Silver tier status, 1 complimentary wifi voucher on first booking for Etihad Airways","3 Etihad Guest Miles per Rs. 100 you spend on Etihad.com, 2 Etihad Guest Miles per Rs. 100 you spend on International transactions, 1 Etihad Guest Mile on other Rs. 100 spends.","Etihad Guest Silver tier status, 2,500 Etihad Guest Miles, free wifi voucher on first Etihad Airways booking, 10% discount on business class and 3% discount on economy class tickets on direct Etihad Airways bookings, up to 5% discount on reward miles redemption, complimentary domestic lounge access, complimentary Priority Pass membership",8 complimentary access to domestic lounges annually (max 2/quarter),"Overseas air accident cover of Rs. 25 lakh, fraud liability cover worth Rs. 50,000, lost baggage cover of up to USD 1,000",NA,"Etihad Guest Miles earned redeemable for booking flights, hotels and renting cars from participating travel partners, and for purchasing products from etihadguest.com or its travel partner services. Etihad Miles can also be used to pay for purchases made using the credit card.",NA,Complimentary Priority Pass membership worth USD 99,"Fraud liability cover of Rs. 50,000 applicable on the lost card from 48 hours prior to reporting and 7 days post reporting.",Annual membership fee waived off (2nd year onwards) on minimum spends of Rs. 3 lakh in the previous year,NA,3.5% (plus applicable taxes),3.5% per month (or 42% annually),"1% fuel surcharge waiver applicable at all fuel stations in India for purchases between Rs. 500 and Rs. 4,000 (max benefit capped at Rs. 250 per payment cycle)",2.5% of the withdrawn amount (subject to a minimum charge of Rs. 500),NA,NA,NA
IRCTC SBI Card Premier,Travel,"Rs. 1,499 + applicable taxes","Rs. 1,499 + applicable taxes","1,500 Reward Points","For every Rs. 125 spent on dining and standing instructions related to utility spends, you will get 3 Reward Points, and 1 Reward Points on every Rs. 125 you spend on other non-fuel retail purchases",Complimentary access to railway lounges per year,8 complimentary visits to railway lounges every year (2 each quarter) within India,"You get insurance coverage against air accidents, railway accidents, and a fraud liability cover.",NA,1 Reward Point = Re. 1.,NA,NA,Zero liability of credit cardholders for any unlawful transactions made through his/her card post reporting the loss to the bank.,Spend-based waiver of renewal fee on the basis of the amount spent in the previous year.,Rs. 99,3.5% on all international transactions,3.5% per month,1% fuel surcharge waiver,"2.5% of the cash advance or Rs. 500, the higher of the two.",NA,NA,NA
IRCTC SBI Platinum Credit Card,Travel,Rs. 500 plus applicable taxes,Rs. 500 plus applicable taxes,Earn 350 activation bonus on a single transaction of Rs 500 or more within 45 days of the activation of the credit card. Earn Rs 100 cashback on ATM cash Withdrawal for the first time.,Earn up to 10% Value Back as Reward Points while you book Railway Tickets on IRCTC. Earn 1 Reward Point for every Rs 125 spent. 1 Reward Point= Re. 1,"Save 1.8% transactions charges by railway tickets on IRCTC’s website. Avail accommodation offers at more than 5000 hotels spread across 350 cities in India. Avail custom made packages from adventure, wildlife to leisure and pilgrimage across India from IRCTC Website.",NA,NA,NA,Redeem your RPs against booking railway tickets on IRCTC ‘s Website.,NA,NA,NA,NA,Rs 99,3.5% of the total transaction value.,3.5% per month or 42% per annum,1% of Fuel Surcharge Waiver (Maximum waiver of Rs 100 per statement cycle) at all fuel stations across India.,2.5% of the total transaction amount (Minimum Rs. 500),NA,NA,NA
IRCTC Rupay SBI Credit Card,Travel,Rs. 500 (plus applicable taxes),Rs. 500 (plus applicable taxes),You get 350 reward points on a minimum transaction of Rs. 500 within 45 days after receiving the card. You also get Rs 100 cashback on your first ATM withdrawal within 30 days of card issuance.,1 Reward Point on every spend of Rs. 125.,You get complimentary railway lounge access every year through the Railway Lounge Program and accommodation at more than 5000 hotels across 350+ cities in India.,4 complimentary domestic railway lounge access every year (1 per quarter).,NA,NA,The RPs you earn are credited to your IRCTC Rupay SBI credit card.,NA,NA,The cardholder will not be liable for any fraudulent transaction done through their card once the card is reported lost/stolen.,NA,Rs. 99,3.5% per foriegn conversion,3.5% per month (42% per annum),"1% fuel surcharge waiver across all petrol pumps in India for all transactions between Rs. 500 to Rs. 3,000. You can get a maximum waiver of Rs. 100 in a statement cycle.",2.5% or Rs. 500 (whichever is higher),NA,NA,NA
Yatra SBI Credit Card,Travel,499 plus applicable taxes,499 plus applicable taxes,Get e-gift vouchers from Yatra.com worth Rs 8250/- on paying the membership fee,"6 Reward Points per Rs. 100 spent on Movies, Groceries, Entertainment, Departmental Stores, Dining
1 Reward Point per Rs. 100 on all other spenings.","You get Rs 1000 off on domestic flight bookings on min transaction of Rs 5,000. You also get Rs Rs. 4,000 off on international flight bookings on min transaction of Rs 40,000 and 20% off on domestic hotels",NA,Complimentary air accidental cover worth Rs 50 lacs,NA,1 RP = Rs 0.25 redeemable through by visiting the SBI Card website or at www. yatra.com website,NA,NA,Protection cover provided in case of any unauthorized transaction made from the credit card if reported within the stipulated time,Annual and renewal fees can be waived if you spend Rs. 1 Lakh in a year.,Rs 99/- per request,3.5% per conversion,3.5% per month (42% per annum),1 % on fuel transactions across all petrol pumps in India,"2.5% of withdrawal amount, subject to a minimum of ₹300",NA,NA,NA
Paytm SBI Credit Card Select,Shopping,"Rs 1,499","Rs 1,499",Get a Complimentary Paytm First Membership is provided on card activation as welcome offer. Welcome Cashback of Rs 750 is provided to the card holder upon activation of the credit card in your Paytm wallet.,"5% cashback on Paytm Mall, Movies, Travel. 2% cashback on all other purchases on Paytm App. 1% cashback on other online and offline spends.",Complimentary Domestic Airport Lounge access and Priority Pass worth US $99.,"Complimentary Domestic Airport Lounge access 4 times in a year, capped to 1 visit per quarter.",Your credit card is protected by Cyber Fraud Insurance Cover worth Rs 2 Lacs which covers financial loss due to fraudulent usage of your credit card by someone else.,NA,NA,NA,Complimentary Priority Pass worth US $99 for 2 years of cardholder membership under the International Lounge Program.,NA,NA,Rs 99,3.5% of the total transaction value.,3.5% per month or 42% per annum.,1% of Fuel Surcharge Waiver (Maximum waiver of Rs 100 per statement cycle).,2.5% of the total transaction amount (Minimum Rs. 500),NA,NA,NA
